{
  "finding_id": "M4-P6A-003",
  "origin": {
    "type": "semgrep",
    "name": "Semgrep 1.179.0",
    "rule_or_check": "workflow_run target-code checkout"
  },
  "provenance": {
    "scan_or_review_id": "semgrep-baseline-fba6a3945b0b",
    "timestamp": "2026-10-07T12:56:38+07:00",
    "source_revision": "fba6a3945b0b59069580a2e2df6423f2503eb7eb",
    "scope_reference": ".github/workflows/deploy-module-4.yml; .github/workflows/deploy.yml",
    "tool_version": "1.179.0",
    "configuration_reference": "uvx semgrep --config=auto --json module-4 .github/workflows"
  },
  "target": {
    "component": "github-workflow",
    "reference": ".github/workflows/deploy-module-4.yml; .github/workflows/deploy.yml",
    "environment": "deployment"
  },
  "observation": {
    "summary": "Semgrep reported the generic workflow_run target-code-checkout pattern in the M4 and M3 deployment workflows. Human review determined that the specific PR-code checkout threat represented by the rule is not applicable to the reviewed implementation because the workflow gates on successful main push runs, checks out the immutable workflow_run head_sha, and verifies the checked-out revision.",
    "classification": "informational-observation"
  },
  "evidence": [
    {
      "type": "scanner-output",
      "reference": "module-4/security-audit/runs/semgrep/semgrep.json",
      "excerpt_or_note": "Baseline Semgrep raw JSON containing the two workflow_run observations.",
      "sha256": "cab0ed7f870f03c4094fca03340388032a3adf260950779958199e9038abc94e"
    },
    {
      "type": "workflow-file",
      "reference": ".github/workflows/deploy-module-4.yml",
      "excerpt_or_note": "M4 privileged deployment workflow reviewed for workflow_run trust semantics.",
      "sha256": "11886e8a8e067bf17f7fc7c420ddce8082df2a58b5c0a052270b6a0ffdd5541c"
    },
    {
      "type": "workflow-file",
      "reference": ".github/workflows/deploy.yml",
      "excerpt_or_note": "Protected M3 deployment workflow reviewed for workflow_run trust semantics.",
      "sha256": "8daae1d91bf51050c48f98c159c2ac1cd27c8b322ce78735ff883c87412863cc"
    },
    {
      "type": "manual-review",
      "reference": "module-4/security-audit/runs/human-disposition.md",
      "excerpt_or_note": "Human review records the observation as false positive under the current implementation.",
      "sha256": "19daec3a714493f2af42ef7f9c45c474f242875b89de4478da42064097a6a50a"
    }
  ],
  "review": {
    "status": "human-dispositioned",
    "reviewer": "human-reviewer",
    "review_timestamp": "2026-10-07T11:18:07Z",
    "disposition": {
      "type": "false-positive-not-applicable",
      "rationale": "The generic scanner pattern is not applicable to the specific PR-code checkout threat in the reviewed workflows. The privileged path gates on successful upstream push completion and main branch context, checks out workflow_run.head_sha, and verifies that the checked-out revision matches that immutable SHA. workflow_run remains a security-sensitive release boundary and this disposition is not a generic claim that workflow_run is safe."
    }
  },
  "remediation": {
    "status": "not-required"
  }
}
